{
  "profile": "core-generation",
  "profile_revision": "v0",
  "requirements": [
    {
      "id": "behavior/driver/assessment-completeness",
      "spec_ref": "specification/core-generation.md#17-case-inventory-for-v0",
      "case_ids": [
        "driver/assessment-completeness"
      ]
    },
    {
      "id": "behavior/driver/concurrent-operations-independent",
      "spec_ref": "specification/core-generation.md#17-case-inventory-for-v0",
      "case_ids": [
        "driver/concurrent-operations-independent"
      ]
    },
    {
      "id": "behavior/driver/http-correction-byte-budget-reset",
      "spec_ref": "specification/core-generation.md#17-case-inventory-for-v0",
      "case_ids": [
        "driver/http-correction-byte-budget-reset"
      ]
    },
    {
      "id": "behavior/driver/timeout-cleanup-disposal",
      "spec_ref": "specification/core-generation.md#17-case-inventory-for-v0",
      "case_ids": [
        "driver/timeout-cleanup-disposal"
      ]
    },
    {
      "id": "behavior/driver/timeout-effective-default-explicit",
      "spec_ref": "specification/core-generation.md#17-case-inventory-for-v0",
      "case_ids": [
        "driver/timeout-effective-default-explicit"
      ]
    },
    {
      "id": "behavior/driver/timeout-reset-per-entry",
      "spec_ref": "specification/core-generation.md#17-case-inventory-for-v0",
      "case_ids": [
        "driver/timeout-reset-per-entry"
      ]
    },
    {
      "id": "behavior/extraction/braces-inside-string",
      "spec_ref": "specification/core-generation.md#6-extraction",
      "case_ids": [
        "extraction/braces-inside-string"
      ]
    },
    {
      "id": "behavior/extraction/duplicate-key-last-value-first-position",
      "spec_ref": "specification/core-generation.md#6-extraction",
      "case_ids": [
        "extraction/duplicate-key-last-value-first-position"
      ]
    },
    {
      "id": "behavior/extraction/empty-response",
      "spec_ref": "specification/core-generation.md#6-extraction",
      "case_ids": [
        "extraction/empty-response"
      ]
    },
    {
      "id": "behavior/extraction/fenced-object-in-prose",
      "spec_ref": "specification/core-generation.md#6-extraction",
      "case_ids": [
        "extraction/fenced-object-in-prose"
      ]
    },
    {
      "id": "behavior/extraction/integer-above-2pow53-preserved",
      "spec_ref": "specification/core-generation.md#6-extraction",
      "case_ids": [
        "extraction/integer-above-2pow53-preserved"
      ]
    },
    {
      "id": "behavior/extraction/malformed-first-candidate-no-rescue",
      "spec_ref": "specification/core-generation.md#6-extraction",
      "case_ids": [
        "extraction/malformed-first-candidate-no-rescue"
      ]
    },
    {
      "id": "behavior/extraction/prose-then-array",
      "spec_ref": "specification/core-generation.md#6-extraction",
      "case_ids": [
        "extraction/prose-then-array"
      ]
    },
    {
      "id": "behavior/extraction/scalar-root-42",
      "spec_ref": "specification/core-generation.md#6-extraction",
      "case_ids": [
        "extraction/scalar-root-42"
      ]
    },
    {
      "id": "behavior/extraction/whole-json-object",
      "spec_ref": "specification/core-generation.md#6-extraction",
      "case_ids": [
        "extraction/whole-json-object"
      ]
    },
    {
      "id": "behavior/lifecycle/repeated-close-idempotent",
      "spec_ref": "specification/core-generation.md#10-streaming-and-public-events",
      "case_ids": [
        "lifecycle/repeated-close-idempotent"
      ]
    },
    {
      "id": "behavior/normalization/empty-messages",
      "spec_ref": "specification/core-generation.md#2-request-normalization",
      "case_ids": [
        "normalization/empty-messages"
      ]
    },
    {
      "id": "behavior/normalization/invalid-sampling-negative-seed",
      "spec_ref": "specification/core-generation.md#2-request-normalization",
      "case_ids": [
        "normalization/invalid-sampling-negative-seed"
      ]
    },
    {
      "id": "behavior/normalization/multi-part-text-concatenated",
      "spec_ref": "specification/core-generation.md#2-request-normalization",
      "case_ids": [
        "normalization/multi-part-text-concatenated"
      ]
    },
    {
      "id": "behavior/normalization/roles-ordered-text",
      "spec_ref": "specification/core-generation.md#2-request-normalization",
      "case_ids": [
        "normalization/roles-ordered-text"
      ]
    },
    {
      "id": "behavior/normalization/sampling-omitted-when-unset",
      "spec_ref": "specification/core-generation.md#2-request-normalization",
      "case_ids": [
        "normalization/sampling-omitted-when-unset"
      ]
    },
    {
      "id": "behavior/normalization/sampling-supplied-fields",
      "spec_ref": "specification/core-generation.md#2-request-normalization",
      "case_ids": [
        "normalization/sampling-supplied-fields"
      ]
    },
    {
      "id": "behavior/normalization/target-empty-model-invalid",
      "spec_ref": "specification/core-generation.md#3-targets-and-route",
      "case_ids": [
        "normalization/target-empty-model-invalid"
      ]
    },
    {
      "id": "behavior/normalization/target-first-colon-model-with-colon",
      "spec_ref": "specification/core-generation.md#3-targets-and-route",
      "case_ids": [
        "normalization/target-first-colon-model-with-colon"
      ]
    },
    {
      "id": "behavior/normalization/target-model-whitespace-stripped",
      "spec_ref": "specification/core-generation.md#3-targets-and-route",
      "case_ids": [
        "normalization/target-model-whitespace-stripped"
      ]
    },
    {
      "id": "behavior/normalization/unsupported-alias-target",
      "spec_ref": "specification/core-generation.md#3-targets-and-route",
      "case_ids": [
        "normalization/unsupported-alias-target"
      ]
    },
    {
      "id": "behavior/normalization/unsupported-image-part",
      "spec_ref": "specification/core-generation.md#2-request-normalization",
      "case_ids": [
        "normalization/unsupported-image-part"
      ]
    },
    {
      "id": "behavior/normalization/unsupported-tool-role",
      "spec_ref": "specification/core-generation.md#2-request-normalization",
      "case_ids": [
        "normalization/unsupported-tool-role"
      ]
    },
    {
      "id": "behavior/repair/correction-prompt-exact-template",
      "spec_ref": "specification/core-generation.md#8-structured-output-and-repair",
      "case_ids": [
        "repair/correction-prompt-exact-template"
      ]
    },
    {
      "id": "behavior/repair/exhaustion-two-invalid",
      "spec_ref": "specification/core-generation.md#8-structured-output-and-repair",
      "case_ids": [
        "repair/exhaustion-two-invalid"
      ]
    },
    {
      "id": "behavior/repair/invalid-then-valid",
      "spec_ref": "specification/core-generation.md#8-structured-output-and-repair",
      "case_ids": [
        "repair/invalid-then-valid"
      ]
    },
    {
      "id": "behavior/repair/invalid-without-repair-fails",
      "spec_ref": "specification/core-generation.md#8-structured-output-and-repair",
      "case_ids": [
        "repair/invalid-without-repair-fails"
      ]
    },
    {
      "id": "behavior/repair/negative-budget-behaves-as-zero",
      "spec_ref": "specification/core-generation.md#8-structured-output-and-repair",
      "case_ids": [
        "repair/negative-budget-behaves-as-zero"
      ]
    },
    {
      "id": "behavior/repair/provider-ceiling-clamp-parameter-dropped",
      "spec_ref": "specification/core-generation.md#8-structured-output-and-repair",
      "case_ids": [
        "repair/provider-ceiling-clamp-parameter-dropped"
      ]
    },
    {
      "id": "behavior/repair/valid-no-correction",
      "spec_ref": "specification/core-generation.md#8-structured-output-and-repair",
      "case_ids": [
        "repair/valid-no-correction"
      ]
    },
    {
      "id": "behavior/repair/zero-budget",
      "spec_ref": "specification/core-generation.md#8-structured-output-and-repair",
      "case_ids": [
        "repair/zero-budget"
      ]
    },
    {
      "id": "behavior/routing/all-targets-failed-trail",
      "spec_ref": "specification/core-generation.md#9-routing-retry-backoff-health",
      "case_ids": [
        "routing/all-targets-failed-trail"
      ]
    },
    {
      "id": "behavior/routing/auth-never-retried",
      "spec_ref": "specification/core-generation.md#9-routing-retry-backoff-health",
      "case_ids": [
        "routing/auth-never-retried"
      ]
    },
    {
      "id": "behavior/routing/backoff-cap",
      "spec_ref": "specification/core-generation.md#9-routing-retry-backoff-health",
      "case_ids": [
        "routing/backoff-cap"
      ]
    },
    {
      "id": "behavior/routing/backoff-retry-after-floor",
      "spec_ref": "specification/core-generation.md#9-routing-retry-backoff-health",
      "case_ids": [
        "routing/backoff-retry-after-floor"
      ]
    },
    {
      "id": "behavior/routing/cleanup-failure-after-final-restarts",
      "spec_ref": "specification/core-generation.md#9-routing-retry-backoff-health",
      "case_ids": [
        "routing/cleanup-failure-after-final-restarts"
      ]
    },
    {
      "id": "behavior/routing/duplicate-target-skipped",
      "spec_ref": "specification/core-generation.md#9-routing-retry-backoff-health",
      "case_ids": [
        "routing/duplicate-target-skipped"
      ]
    },
    {
      "id": "behavior/routing/health-recovery-after-ttl",
      "spec_ref": "specification/core-generation.md#9-routing-retry-backoff-health",
      "case_ids": [
        "routing/health-recovery-after-ttl"
      ]
    },
    {
      "id": "behavior/routing/health-skip-in-trail",
      "spec_ref": "specification/core-generation.md#9-routing-retry-backoff-health",
      "case_ids": [
        "routing/health-skip-in-trail"
      ]
    },
    {